{
  "schema_version": "1.0",
  "algorithm": "ed25519",
  "review": {
    "review_id": "REV-SDG-008",
    "reviewer_id": "codex-sdg-independent-reviewer",
    "builder_id": "codex",
    "change_digest": "00d25746f1f6eecef7ec4e4448c4d5fdf000c7a6af2bd3b52b3131ee74277e60",
    "gate_metadata_digest": "2d43a8b5ff4518a9abc32ee8553924d744e4b0514562cfeafdb17caefe8b4768",
    "verdict": "approved",
    "issued_at": "2026-08-16T04:14:23Z",
    "expires_at": "2026-08-16T05:14:23Z",
    "nonce": "MuZMgw60DL0yL6uLIdpEcPv3"
  },
  "signature": "GHf8qldxxJSxxDcj2CLzgHJAxFMYifhycTI/qUxX8WEwez4VKt+Z2aFIu8eE7a3eoezoDGukwILQK4QwTopfAQ=="
}
